{"attribution":"Data courtesy of nflverse (CC BY 4.0). Unofficial fan-made project; not affiliated with the NFL.","fitSeasons":[2010,2025],"aging":[{"pos":"QB","byAge":{"21":3.12,"22":1.5,"23":1.28,"24":0.21,"25":-0.16,"26":-0.68,"27":-0.61,"28":-0.7,"29":-0.79,"30":-0.97,"31":-0.84,"32":-0.95,"33":-1.03,"34":-1.61,"35":-1.55,"36":-1.32,"37":-1.2,"38":-1.0,"39":-1.73,"40":-1.57,"41":-2.27,"42":-1.41},"sd":6.82},{"pos":"RB","byAge":{"21":0.28,"22":0.22,"23":-0.12,"24":-0.33,"25":-0.59,"26":-0.88,"27":-0.94,"28":-1.4,"29":-1.48,"30":-1.91,"31":-2.34,"32":-2.85,"33":-3.43,"34":-3.08,"35":-3.32,"36":-3.69,"37":-4.74,"38":-5.65,"39":-2.1,"40":0.0,"41":0.0,"42":0.0},"sd":7.68},{"pos":"WR","byAge":{"21":2.19,"22":1.5,"23":1.13,"24":0.69,"25":0.44,"26":0.07,"27":-0.29,"28":-0.74,"29":-1.61,"30":-2.04,"31":-2.46,"32":-2.47,"33":-2.64,"34":-3.23,"35":-3.54,"36":-3.53,"37":-3.21,"38":-4.15,"39":-4.91,"40":-6.0,"41":0.0,"42":0.0},"sd":7.24},{"pos":"TE","byAge":{"21":1.07,"22":1.6,"23":1.52,"24":1.43,"25":1.1,"26":0.65,"27":0.22,"28":-0.39,"29":-0.79,"30":-1.44,"31":-1.98,"32":-2.19,"33":-2.57,"34":-1.97,"35":-2.51,"36":-1.94,"37":-2.83,"38":-3.47,"39":-4.17,"40":-5.22,"41":-3.78,"42":-4.38},"sd":7.07},{"pos":"OL","byAge":{"21":0.22,"22":1.06,"23":1.1,"24":1.46,"25":1.55,"26":1.53,"27":1.39,"28":1.03,"29":0.55,"30":0.02,"31":-0.48,"32":-0.97,"33":-1.24,"34":-1.32,"35":-1.26,"36":-1.39,"37":-1.71,"38":-2.35,"39":-2.25,"40":-2.17,"41":-0.9,"42":-1.31},"sd":7.43},{"pos":"DL","byAge":{"21":4.02,"22":2.63,"23":2.15,"24":1.53,"25":1.2,"26":0.85,"27":0.4,"28":-0.02,"29":-0.54,"30":-1.04,"31":-1.64,"32":-2.27,"33":-2.84,"34":-3.2,"35":-3.28,"36":-2.95,"37":-2.74,"38":-2.45,"39":-3.37,"40":-3.88,"41":-4.05,"42":0.0},"sd":6.63},{"pos":"LB","byAge":{"21":2.73,"22":1.88,"23":1.43,"24":1.08,"25":0.82,"26":0.67,"27":0.35,"28":-0.09,"29":-0.73,"30":-1.15,"31":-1.58,"32":-1.97,"33":-2.66,"34":-3.26,"35":-3.22,"36":-2.92,"37":-2.22,"38":-1.87,"39":-1.44,"40":-0.44,"41":-3.4,"42":0.0},"sd":6.96},{"pos":"CB","byAge":{"21":2.75,"22":1.97,"23":1.65,"24":1.27,"25":0.89,"26":0.81,"27":0.36,"28":0.18,"29":-0.55,"30":-1.04,"31":-1.79,"32":-2.51,"33":-2.93,"34":-3.18,"35":-3.05,"36":-2.52,"37":-1.98,"38":-1.62,"39":-1.72,"40":-3.54,"41":-3.8,"42":0.0},"sd":6.95},{"pos":"S","byAge":{"21":4.6,"22":2.39,"23":2.1,"24":1.17,"25":1.02,"26":0.84,"27":0.68,"28":0.13,"29":-0.5,"30":-1.11,"31":-1.53,"32":-1.94,"33":-2.12,"34":-2.36,"35":-2.58,"36":-2.26,"37":-3.51,"38":-3.22,"39":-3.81,"40":-3.04,"41":1.0,"42":0.0},"sd":7.02},{"pos":"K","byAge":{"21":-1.39,"22":-0.73,"23":-1.16,"24":-0.47,"25":-0.39,"26":0.17,"27":0.23,"28":0.67,"29":0.32,"30":-0.05,"31":-0.68,"32":-0.91,"33":-0.93,"34":-0.9,"35":-0.7,"36":-1.19,"37":-1.78,"38":-2.6,"39":-2.53,"40":-2.31,"41":-1.42,"42":-1.82},"sd":7.67},{"pos":"P","byAge":{"21":-0.69,"22":0.91,"23":0.34,"24":0.5,"25":-0.02,"26":0.17,"27":0.1,"28":-0.26,"29":-0.55,"30":-0.98,"31":-0.89,"32":-0.79,"33":-1.15,"34":-1.51,"35":-2.22,"36":-3.57,"37":-4.78,"38":-4.87,"39":-4.04,"40":-3.26,"41":-3.08,"42":-5.84},"sd":7.3}],"slotGrade":[{"pick":1,"ovr":79.6,"pot":82.5,"sd":15.85},{"pick":2,"ovr":78.6,"pot":81.5,"sd":11.61},{"pick":3,"ovr":77.7,"pot":80.7,"sd":11.65},{"pick":4,"ovr":76.9,"pot":80.0,"sd":13.73},{"pick":5,"ovr":76.3,"pot":79.3,"sd":14.45},{"pick":8,"ovr":74.7,"pot":77.8,"sd":13.73},{"pick":10,"ovr":73.8,"pot":76.9,"sd":13.41},{"pick":12,"ovr":73.1,"pot":76.2,"sd":12.97},{"pick":16,"ovr":71.8,"pot":75.0,"sd":12.33},{"pick":20,"ovr":70.8,"pot":74.0,"sd":12.16},{"pick":24,"ovr":69.9,"pot":73.1,"sd":11.98},{"pick":28,"ovr":69.2,"pot":72.4,"sd":11.66},{"pick":32,"ovr":68.5,"pot":71.8,"sd":11.3},{"pick":40,"ovr":67.4,"pot":70.7,"sd":10.8},{"pick":48,"ovr":66.5,"pot":69.7,"sd":10.6},{"pick":56,"ovr":65.7,"pot":69.0,"sd":10.52},{"pick":64,"ovr":65.0,"pot":68.3,"sd":10.44},{"pick":80,"ovr":63.8,"pot":67.1,"sd":10.22},{"pick":96,"ovr":62.8,"pot":66.2,"sd":10.07},{"pick":112,"ovr":62.0,"pot":65.4,"sd":10.1},{"pick":128,"ovr":61.3,"pot":64.7,"sd":10.26},{"pick":144,"ovr":60.6,"pot":64.0,"sd":10.47},{"pick":160,"ovr":60.0,"pot":63.5,"sd":10.69},{"pick":180,"ovr":59.4,"pot":62.8,"sd":10.94},{"pick":200,"ovr":58.8,"pot":62.3,"sd":11.15},{"pick":224,"ovr":58.2,"pot":61.7,"sd":11.34},{"pick":250,"ovr":57.6,"pot":61.1,"sd":11.49}],"udfaGrade":{"ovrMean":48.3,"ovrSd":9.83,"potQuantiles":[41.0,41.5,47.4,62.7,69.4]},"outcomes":[{"bucket":"1-10","pickMin":1,"pickMax":10,"pos":"ALL","years":[1,2,3,4,5,6,7,8],"quantiles":[0.1,0.25,0.5,0.75,0.9],"values":[[63.2,69.3,74.6,79.7,84.9],[67.4,71.1,76.0,82.1,86.2],[66.0,71.0,77.0,82.5,86.5],[59.1,68.1,76.2,82.1,88.1],[59.4,68.8,77.7,85.1,91.5],[42.6,67.5,76.8,83.9,91.9],[41.8,63.5,77.1,84.3,90.6],[40.0,57.0,75.1,83.7,87.9]],"bustRate":0.018},{"bucket":"1-10","pickMin":1,"pickMax":10,"pos":"QB","years":[1,2,3,4,5,6,7,8],"quantiles":[0.1,0.25,0.5,0.75,0.9],"values":[[67.0,67.8,69.9,74.6,78.4],[68.7,71.2,73.8,77.8,83.2],[66.6,70.2,76.8,81.8,83.8],[63.2,70.0,74.3,77.2,80.8],[44.3,67.3,72.5,79.3,87.3],[40.5,58.6,70.1,74.6,81.5],[42.1,63.1,72.0,77.2,82.8],[41.6,49.6,70.4,76.2,80.2]],"bustRate":0.0},{"bucket":"1-10","pickMin":1,"pickMax":10,"pos":"OL","years":[1,2,3,4,5,6,7,8],"quantiles":[0.1,0.25,0.5,0.75,0.9],"values":[[58.2,64.3,73.4,76.8,79.0],[61.0,69.1,72.7,76.2,81.3],[59.5,68.5,73.8,76.3,79.8],[59.7,63.1,69.8,78.4,84.6],[61.8,65.2,76.6,81.9,85.9],[58.2,69.7,79.6,84.9,92.2],[41.4,42.9,77.7,86.5,94.4],[40.0,41.8,77.7,86.3,89.3]],"bustRate":0.0},{"bucket":"1-10","pickMin":1,"pickMax":10,"pos":"DL","years":[1,2,3,4,5,6,7,8],"quantiles":[0.1,0.25,0.5,0.75,0.9],"values":[[69.3,73.0,75.7,83.6,87.7],[70.1,72.8,78.2,82.9,84.6],[69.3,73.2,78.0,81.7,82.7],[65.4,72.4,77.1,83.2,88.1],[71.4,75.5,77.5,88.6,92.0],[69.1,75.2,81.3,84.5,87.7],[58.8,70.5,79.4,86.0,88.0],[68.0,70.5,76.8,82.3,87.2]],"bustRate":0.0},{"bucket":"11-32","pickMin":11,"pickMax":32,"pos":"ALL","years":[1,2,3,4,5,6,7,8],"quantiles":[0.1,0.25,0.5,0.75,0.9],"values":[[58.9,64.5,70.2,76.1,81.3],[61.7,66.7,73.2,78.5,82.6],[54.7,65.2,73.4,79.9,85.0],[55.8,66.0,73.2,79.9,84.7],[41.3,65.4,73.5,81.9,87.7],[40.0,63.1,73.3,81.3,86.3],[40.0,42.3,73.3,80.8,87.2],[40.0,40.0,70.1,78.8,84.5]],"bustRate":0.045},{"bucket":"11-32","pickMin":11,"pickMax":32,"pos":"WR","years":[1,2,3,4,5,6,7,8],"quantiles":[0.1,0.25,0.5,0.75,0.9],"values":[[62.1,66.7,71.4,75.7,80.3],[62.3,65.4,75.7,80.0,82.6],[54.8,61.9,76.7,83.9,88.4],[41.7,65.8,75.0,80.1,87.1],[41.3,57.4,71.7,84.7,87.6],[40.0,42.4,72.1,78.0,82.4],[40.0,41.1,64.3,78.4,81.6],[40.0,40.0,64.2,75.4,78.0]],"bustRate":0.103},{"bucket":"11-32","pickMin":11,"pickMax":32,"pos":"OL","years":[1,2,3,4,5,6,7,8],"quantiles":[0.1,0.25,0.5,0.75,0.9],"values":[[53.0,60.5,66.1,70.3,81.3],[56.5,62.3,67.0,74.2,80.8],[53.9,62.3,68.9,75.6,80.3],[57.6,66.3,70.2,77.4,81.1],[55.7,65.6,72.7,80.3,88.5],[40.0,65.4,73.2,81.1,89.5],[40.2,63.4,75.4,82.5,89.9],[40.0,42.5,72.9,82.9,84.9]],"bustRate":0.042},{"bucket":"11-32","pickMin":11,"pickMax":32,"pos":"DL","years":[1,2,3,4,5,6,7,8],"quantiles":[0.1,0.25,0.5,0.75,0.9],"values":[[61.1,64.2,68.1,73.7,80.2],[65.3,68.8,72.8,77.0,81.2],[64.3,69.9,75.5,81.2,86.0],[61.3,68.5,77.1,80.5,84.7],[63.1,69.3,74.1,83.0,87.7],[51.6,68.9,74.8,81.5,86.5],[40.0,62.9,73.6,80.9,88.3],[40.0,42.3,72.7,79.7,84.9]],"bustRate":0.0},{"bucket":"11-32","pickMin":11,"pickMax":32,"pos":"LB","years":[1,2,3,4,5,6,7,8],"quantiles":[0.1,0.25,0.5,0.75,0.9],"values":[[63.9,67.1,71.2,78.2,81.4],[64.0,71.7,76.4,79.9,84.1],[60.8,71.3,77.0,80.5,84.2],[60.0,67.9,74.4,80.7,85.6],[41.5,59.5,78.3,82.8,85.5],[40.0,52.0,77.7,83.4,84.8],[40.0,40.0,73.1,80.8,85.8],[40.0,40.0,63.4,80.8,84.3]],"bustRate":0.0},{"bucket":"11-32","pickMin":11,"pickMax":32,"pos":"CB","years":[1,2,3,4,5,6,7,8],"quantiles":[0.1,0.25,0.5,0.75,0.9],"values":[[59.9,64.0,70.6,77.5,81.0],[64.6,68.9,73.9,77.7,79.6],[61.0,65.3,71.7,79.7,84.1],[47.4,65.6,72.8,78.6,82.5],[40.5,67.3,73.7,81.0,89.3],[46.3,64.0,74.8,83.2,86.3],[41.2,68.3,73.7,81.5,85.5],[40.0,42.6,72.5,79.2,84.5]],"bustRate":0.029},{"bucket":"11-32","pickMin":11,"pickMax":32,"pos":"S","years":[1,2,3,4,5,6,7,8],"quantiles":[0.1,0.25,0.5,0.75,0.9],"values":[[64.9,70.6,73.2,77.4,83.5],[69.0,71.0,75.3,79.9,86.4],[53.2,70.7,73.8,78.5,86.8],[65.7,69.8,72.3,76.4,81.0],[55.5,67.3,70.3,76.1,87.9],[56.0,67.1,70.5,79.9,90.0],[40.0,42.1,72.2,79.4,89.4],[40.0,41.2,71.1,79.4,90.1]],"bustRate":0.0},{"bucket":"33-64","pickMin":33,"pickMax":64,"pos":"ALL","years":[1,2,3,4,5,6,7,8],"quantiles":[0.1,0.25,0.5,0.75,0.9],"values":[[50.1,60.1,68.0,73.4,79.2],[55.6,63.0,70.4,76.0,82.3],[42.7,62.2,70.5,76.7,82.5],[41.3,59.7,71.0,77.3,83.4],[40.0,55.4,70.0,78.2,83.8],[40.0,42.2,69.1,78.1,83.9],[40.0,40.0,65.2,75.6,82.9],[40.0,40.0,45.6,73.7,80.8]],"bustRate":0.054},{"bucket":"33-64","pickMin":33,"pickMax":64,"pos":"RB","years":[1,2,3,4,5,6,7,8],"quantiles":[0.1,0.25,0.5,0.75,0.9],"values":[[40.2,66.5,71.6,81.0,84.5],[60.3,69.6,74.6,78.8,82.5],[41.8,64.3,75.1,80.2,82.5],[40.0,56.5,72.3,79.6,88.7],[40.0,40.0,65.2,76.5,85.0],[40.0,40.0,60.7,74.1,83.9],[40.0,40.0,40.0,59.9,76.1],[40.0,40.0,40.0,59.0,70.8]],"bustRate":0.156},{"bucket":"33-64","pickMin":33,"pickMax":64,"pos":"WR","years":[1,2,3,4,5,6,7,8],"quantiles":[0.1,0.25,0.5,0.75,0.9],"values":[[58.1,65.0,71.1,74.5,79.7],[59.9,67.3,72.2,78.7,85.2],[53.6,64.4,72.9,80.1,83.7],[40.0,54.6,71.5,77.7,81.2],[41.2,42.7,69.4,78.2,82.7],[40.0,42.3,66.2,78.4,81.4],[40.0,41.6,66.0,78.0,82.4],[40.0,40.0,42.3,73.6,76.9]],"bustRate":0.078},{"bucket":"33-64","pickMin":33,"pickMax":64,"pos":"TE","years":[1,2,3,4,5,6,7,8],"quantiles":[0.1,0.25,0.5,0.75,0.9],"values":[[62.0,66.3,70.0,74.9,79.2],[57.6,68.3,76.1,78.6,84.6],[59.8,62.7,71.8,81.9,83.1],[63.1,68.5,73.9,84.7,88.9],[54.2,69.2,75.0,82.2,90.9],[42.1,63.3,73.3,84.8,87.7],[40.0,40.0,71.2,82.4,87.6],[40.0,40.0,64.4,81.3,88.4]],"bustRate":0.0},{"bucket":"33-64","pickMin":33,"pickMax":64,"pos":"OL","years":[1,2,3,4,5,6,7,8],"quantiles":[0.1,0.25,0.5,0.75,0.9],"values":[[48.1,60.4,69.4,73.3,78.6],[58.0,62.2,68.4,73.7,78.7],[56.1,63.7,69.5,73.7,76.6],[5